{
  "pipeline_version": "1.0",
  "dispatched_at": "2026-05-12T20:48:22Z",
  "week_ref": "2026-W19",
  "week_start": "2026-05-04",
  "week_end": "2026-05-10",
  "language": "English",
  "research_summary": {
    "dominant_theme": "Compute capacity displaced model quality as the binding constraint on the frontier, forcing alliances between formal rivals.",
    "market_mood": "bullish",
    "biggest_move_actor": "Anthropic",
    "items_evaluated": 38
  },
  "newsletter": {
    "meta": {
      "generated_at": "2026-05-12T06:35:00Z",
      "week_start": "2026-05-04",
      "week_end": "2026-05-10",
      "week_ref": "2026-W19",
      "language": "English",
      "bullet_count": 16,
      "estimated_read_time_seconds": 195
    },
    "section_1": {
      "intro": "This was the week capex stopped being a footnote in the frontier story. Anthropic rented its entire next leg of compute from Elon Musk's SpaceX while shipping Opus 4.7, OpenAI made GPT-5.5 Instant the new ChatGPT default, and MCP went from Anthropic protocol to cross-vendor substrate in seven days. If your AI thesis still indexes on parameter counts and eval scores, you are reading last quarter's game.",
      "featured_story": {
        "actor": "Anthropic",
        "headline": "Anthropic rents Colossus 1 from SpaceX and resets what the frontier is competing on",
        "body": "Anthropic took the entire 300 megawatt Colossus 1 cluster from SpaceX on May 6 — roughly 220,000 NVIDIA GPUs from a data center owned by the parent of its closest rival — and used the capacity the same day to double Claude Code rate limits for paid tiers and remove peak-hours throttles on Pro and Max. The signal is not partnership; it is supply. When a frontier lab rents capacity from a competitor's data center, capex has become the binding constraint on the frontier, not parameters or evals. For practitioners that means infrastructure visibility now belongs in any frontier-lab thesis, alongside model quality and ecosystem reach.",
        "forward_tension": "Watch whether a second frontier lab follows by renting compute from a rival cluster in the next sixty days — that is the move that confirms compute has become a commodity, not a moat."
      }
    },
    "section_2": {
      "bullets": [
        {
          "rank": 1,
          "label": "MODEL",
          "actor": "Anthropic",
          "fact": "Made Claude Opus 4.7 generally available on May 4 with a 1 million token context window, improved long-running coding, and higher-resolution vision at unchanged pricing ($5 in / $25 out per 1M tokens).",
          "implication": "1M context on Opus pricing turns extended-document analysis from a workflow problem into a single API call.",
          "repo_meta": {
            "owner_repo": null,
            "stars_total": 0,
            "stars_weekly_delta": 0
          }
        },
        {
          "rank": 2,
          "label": "MODEL",
          "actor": "OpenAI",
          "fact": "Rolled out GPT-5.5 Instant on May 5 as the new ChatGPT default and as chat-latest in the API, with GPT-5.3 Instant kept available to paid users for a three-month deprecation window.",
          "implication": "Default model swap means consumer ChatGPT quality and API chat-latest behavior shifted overnight; downstream apps pinning chat-latest should retest immediately.",
          "repo_meta": {
            "owner_repo": null,
            "stars_total": 0,
            "stars_weekly_delta": 0
          }
        },
        {
          "rank": 3,
          "label": "SIGNAL",
          "actor": "Industry",
          "fact": "MCP became the cross-vendor agent substrate this week as AWS, Google, and Microsoft each shipped first-party MCP-native servers or frameworks within 48 hours of each other.",
          "implication": "Proprietary connector marketplaces are now competing against a shared substrate; vendor lock-in at the connector layer just lost most of its leverage.",
          "repo_meta": {
            "owner_repo": null,
            "stars_total": 0,
            "stars_weekly_delta": 0
          }
        },
        {
          "rank": 4,
          "label": "AGENT",
          "actor": "AWS",
          "fact": "AWS MCP Server reached general availability on May 6 with IAM guardrails, CloudWatch metrics, CloudTrail logging, and sandboxed Python execution against AWS services for coding agents.",
          "implication": "Closes the audit gap on agent-driven cloud operations; enterprise procurement teams can now buy MCP without writing their own observability layer.",
          "repo_meta": {
            "owner_repo": null,
            "stars_total": 0,
            "stars_weekly_delta": 0
          }
        },
        {
          "rank": 5,
          "label": "AGENT",
          "actor": "Microsoft",
          "fact": "Shipped Agent Framework 1.0 on May 6 with multi-agent orchestration, multi-provider model routing, and cross-runtime interoperability over A2A and MCP.",
          "implication": "First credible enterprise multi-agent runtime that is provider-agnostic by default — pressures every framework to support both A2A and MCP or lose Microsoft-shop deals.",
          "repo_meta": {
            "owner_repo": null,
            "stars_total": 0,
            "stars_weekly_delta": 0
          }
        },
        {
          "rank": 6,
          "label": "MODEL",
          "actor": "xAI",
          "fact": "Launched SuperGrok Heavy plus standalone Grok Speech-to-Text, Text-to-Speech, and Quality Mode Imagine APIs, with multilingual support and speaker diarization in voice.",
          "implication": "Voice and image stacks are now first-party on Grok, narrowing OpenAI Realtime's lead and giving X-native developers a parallel multimodal path.",
          "repo_meta": {
            "owner_repo": null,
            "stars_total": 0,
            "stars_weekly_delta": 0
          }
        },
        {
          "rank": 7,
          "label": "DEV",
          "actor": "Anthropic",
          "fact": "Shipped Claude Code plugins via --plugin-url and .zip packages, an agent view for managing multiple sessions, and the /radio command; rate limits doubled on Pro and Max after the SpaceX deal.",
          "implication": "Plugin sourcing plus the agent view make Claude Code the first coding agent with a real third-party distribution and multi-session story; the rate-limit lift removes the most common ceiling on heavy users.",
          "repo_meta": {
            "owner_repo": null,
            "stars_total": 0,
            "stars_weekly_delta": 0
          }
        },
        {
          "rank": 8,
          "label": "DEV",
          "actor": "OpenAI",
          "fact": "Released three Realtime voice models in the API on May 7 — GPT-Realtime-2 for live reasoning, GPT-Realtime-Translate for multilingual speech, GPT-Realtime-Whisper for streaming transcription.",
          "implication": "Splits voice into reasoning, translation, and transcription as distinct API surfaces; voice-agent builders should re-architect around three thin services instead of one fat model.",
          "repo_meta": {
            "owner_repo": null,
            "stars_total": 0,
            "stars_weekly_delta": 0
          }
        },
        {
          "rank": 9,
          "label": "AGENT",
          "actor": "Google",
          "fact": "Opened Workspace MCP server to public developer preview on May 7, exposing Gmail and Drive as MCP tools with Workspace identity controls.",
          "implication": "Email and storage become directly callable from any MCP-compatible agent — the missing third leg of the hyperscaler MCP rollout.",
          "repo_meta": {
            "owner_repo": null,
            "stars_total": 0,
            "stars_weekly_delta": 0
          }
        },
        {
          "rank": 10,
          "label": "DEV",
          "actor": "Anthropic",
          "fact": "Launched the Claude Platform on AWS on May 6 with managed agents, code execution, web tools, skills, and prompt caching billable through AWS commitments.",
          "implication": "Removes procurement friction for AWS-centric enterprises; pulls Claude into existing AWS spend envelopes without a separate vendor onboarding.",
          "repo_meta": {
            "owner_repo": null,
            "stars_total": 0,
            "stars_weekly_delta": 0
          }
        },
        {
          "rank": 11,
          "label": "REPO",
          "actor": "mattpocock/skills",
          "fact": "mattpocock/skills (star 71,700 | +20,000 this week) — reusable Claude Code skills repo that spent the week as the #1 trending AI repo after six straight days at #2.",
          "implication": "Skill libraries, not new agent frameworks, are where practitioner attention concentrated; the unit of reuse is shrinking from agent to skill.",
          "repo_meta": {
            "owner_repo": "mattpocock/skills",
            "stars_total": 71700,
            "stars_weekly_delta": 20000
          }
        },
        {
          "rank": 12,
          "label": "REPO",
          "actor": "affaan-m/everything-claude-code",
          "fact": "affaan-m/everything-claude-code (star ~100,000 | +543 this week) — Claude Code agent harness with 28 subagents, 119 skills, 60 slash commands, and 14 MCP servers; crossed 100K stars in three months.",
          "implication": "Confirms there is real demand for fully assembled agent harnesses, not just primitives — bundles win where toolchains are still in flux.",
          "repo_meta": {
            "owner_repo": "affaan-m/everything-claude-code",
            "stars_total": 100000,
            "stars_weekly_delta": 543
          }
        },
        {
          "rank": 13,
          "label": "REPO",
          "actor": "msitarzewski/agency-agents",